{
  "schemaVersion": 1,
  "id": "tarot22",
  "name": { "zh": "塔罗大阿尔卡纳 22", "ja": "タロット大アルカナ22" },
  "description": {
    "zh": "按原书「也可以直接用塔罗牌」的授权准备的大阿尔卡纳 22 张。牌名沿用通行的中文与日文译名；释义与问句为本应用为故事训练而创作，不是任何塔罗原著的解释。符号为 0–XXI 的罗马编号，仅作装饰。",
    "ja": "原書の「タロットを直接用いてもよい」という許しに従って用意した大アルカナ22枚。札名は一般的な日本語・中国語訳を用いる。意味と問いは本アプリが物語訓練のために作ったもので、いかなるタロット原典の解釈でもない。記号は 0–XXI のローマ数字で、装飾にすぎない。"
  },
  "cards": [
    {
      "id": "tarot22-00",
      "word": { "zh": "愚者", "ja": "愚者" },
      "symbol": "0",
      "upright": { "zh": "什么都还没定，所以什么都有可能。凭一股轻快迈出去。", "ja": "まだ何も決まっていない。だから何にでもなれる。軽やかさで踏み出す。" },
      "reversed": { "zh": "把无知当成自由，没准备好就出发，也没有回头路。", "ja": "無知を自由と取り違え、準備もなく出発し、戻る道もない。" },
      "questions": {
        "upright": { "zh": "如果不怕丢脸，你现在最想试的是什么？", "ja": "恥をかくのが怖くなければ、いま一番試したいことは何か。" },
        "reversed": { "zh": "你还没准备好的是什么，行李还是决心？", "ja": "まだ整っていないのは何か。荷物か、それとも覚悟か。" }
      }
    },
    {
      "id": "tarot22-01",
      "word": { "zh": "魔术师", "ja": "魔術師" },
      "symbol": "I",
      "upright": { "zh": "手上的工具齐了，剩下的是开口说出要做什么。", "ja": "道具は揃っている。あとは何をするか口にすることだけだ。" },
      "reversed": { "zh": "工具摆得漂亮，却只用来表演，不动真格。", "ja": "道具は美しく並ぶが、見せるためだけに使われ、本気にならない。" },
      "questions": {
        "upright": { "zh": "你手上已有的资源，能立刻做出什么？", "ja": "手持ちの資源で、すぐ何が作れるか。" },
        "reversed": { "zh": "你在表演给谁看，而不敢真的动手？", "ja": "誰に見せるために演じ、本当に手を動かせずにいるのか。" }
      }
    },
    {
      "id": "tarot22-02",
      "word": { "zh": "女祭司", "ja": "女教皇" },
      "symbol": "II",
      "upright": { "zh": "还没到说出口的时候，先听清心里那个微小的声音。", "ja": "まだ口にする時ではない。まず内なる小さな声に耳を澄ます。" },
      "reversed": { "zh": "把沉默当成答案，结果错过了该开口的时机。", "ja": "沈黙を答えにしてしまい、口を開くべき時を逃す。" },
      "questions": {
        "upright": { "zh": "那个你一直压着不说的直觉，讲的是什么？", "ja": "ずっと押し込めている直感は、何を告げているか。" },
        "reversed": { "zh": "你不说，是在保护谁？", "ja": "言わないことで、誰を守っているのか。" }
      }
    },
    {
      "id": "tarot22-03",
      "word": { "zh": "女皇", "ja": "女帝" },
      "symbol": "III",
      "upright": { "zh": "有东西正在丰盛地长出来，需要的是照料，不是催促。", "ja": "何かが豊かに育ちつつある。必要なのは手入れであって、せかすことではない。" },
      "reversed": { "zh": "只顾着产出，忘了照顾自己，枯竭已经写在脸上。", "ja": "産み出すことばかりで自分を顧みず、枯渇が顔に出ている。" },
      "questions": {
        "upright": { "zh": "这件正在生长的事，最需要什么样的照看？", "ja": "育ちつつあるこれに、どんな手入れが必要か。" },
        "reversed": { "zh": "你把自己排在了清单的第几位？", "ja": "自分の順番は、一覧の何番目か。" }
      }
    },
    {
      "id": "tarot22-04",
      "word": { "zh": "皇帝", "ja": "皇帝" },
      "symbol": "IV",
      "upright": { "zh": "立规矩的那一刻，秩序带来安全，也带来重量。", "ja": "決まりを立てた瞬間、秩序は安全と同時に重さをもたらす。" },
      "reversed": { "zh": "规矩变成了压制，谁都不敢出声。", "ja": "決まりが抑圧に変わり、誰も声を上げられない。" },
      "questions": {
        "upright": { "zh": "你需要立下的那条规矩，保护的是谁？", "ja": "立てるべき決まりは、誰を守るものか。" },
        "reversed": { "zh": "你在谁面前，连话都不敢说？", "ja": "誰の前で、口すら開けずにいるのか。" }
      }
    },
    {
      "id": "tarot22-05",
      "word": { "zh": "教皇", "ja": "教皇" },
      "symbol": "V",
      "upright": { "zh": "有一套已经验证过的做法可以借，先学会再谈突破。", "ja": "すでに検証済みのやり方を借りてよい。まず習い、それから破れ。" },
      "reversed": { "zh": "把传承当教条，形式还在，信念已经空了。", "ja": "継承を教条とし、形式だけが残って信念は空になる。" },
      "questions": {
        "upright": { "zh": "这套前人留下的方法，哪一部分对你真的有用？", "ja": "先人が遺したやり方の、どの部分が本当に役立つか。" },
        "reversed": { "zh": "你遵守的哪条规矩，自己其实并不相信？", "ja": "従っているどの決まりを、実は信じていないのか。" }
      }
    },
    {
      "id": "tarot22-06",
      "word": { "zh": "恋人", "ja": "恋人" },
      "symbol": "VI",
      "upright": { "zh": "在两样都珍贵的东西之间做选择，选了就要认。", "ja": "どちらも大切なものの間で選ぶ。選んだ以上は認める。" },
      "reversed": { "zh": "想两边都要，结果两边都留不住。", "ja": "どちらも欲しがった結果、どちらも手に残らない。" },
      "questions": {
        "upright": { "zh": "这一次的选择，其实是在选成为什么样的人？", "ja": "この選択は、どんな人間になるかの選択でもあるのではないか。" },
        "reversed": { "zh": "两边都不放的代价，你已经付到哪一步了？", "ja": "どちらも手放さない代償を、どこまで払っているか。" }
      }
    },
    {
      "id": "tarot22-07",
      "word": { "zh": "战车", "ja": "戦車" },
      "symbol": "VII",
      "upright": { "zh": "牵住两匹往不同方向跑的马拉车，靠的是意志不是蛮力。", "ja": "違う方向へ走る二頭を御して進む。頼りは意志であり、力任せではない。" },
      "reversed": { "zh": "缰绳松了，被自己拉着的力气反过来拖走。", "ja": "手綱が緩み、自分が引いていた力に逆に引きずられる。" },
      "questions": {
        "upright": { "zh": "你正要驯服的那两股力量，分别是什么？", "ja": "御そうとしている二つの力とは、それぞれ何か。" },
        "reversed": { "zh": "你现在被哪一股冲动拖着走？", "ja": "いま、どの衝動に引っ張られているのか。" }
      }
    },
    {
      "id": "tarot22-08",
      "word": { "zh": "力量", "ja": "力" },
      "symbol": "VIII",
      "upright": { "zh": "真正的强是安抚而非镇压：狮子被温柔地按住。", "ja": "本当の強さは鎮めることではなく宥めること。獅子は優しく押さえられる。" },
      "reversed": { "zh": "力量用错了地方，压住了别人，压不住自己。", "ja": "力の使いどころを誤り、他人は押さえられても自分は押さえられない。" },
      "questions": {
        "upright": { "zh": "你身上那头要安抚的狮子，是什么？", "ja": "宥めるべき獅子とは、あなたの中の何か。" },
        "reversed": { "zh": "你在对谁用力，其实是拿他出气？", "ja": "誰に力を振るうことで、じつは八つ当たりしているのか。" }
      }
    },
    {
      "id": "tarot22-09",
      "word": { "zh": "隐者", "ja": "隠者" },
      "symbol": "IX",
      "upright": { "zh": "退到没人打扰的地方，用一盏小灯照自己的路。", "ja": "誰にも邪魔されない場所へ退き、小さな灯で自分の道を照らす。" },
      "reversed": { "zh": "退得过头，成了逃避，灯也不再照别人。", "ja": "退きすぎて逃避になり、灯は他人を照らさなくなる。" },
      "questions": {
        "upright": { "zh": "独自想清楚的那件事，答案现在清楚了几分？", "ja": "一人で考えたその件、答えはどこまで見えたか。" },
        "reversed": { "zh": "你躲开的，是人群还是某个具体的人？", "ja": "避けているのは人混みか、それとも特定の誰かか。" }
      }
    },
    {
      "id": "tarot22-10",
      "word": { "zh": "命运之轮", "ja": "運命の輪" },
      "symbol": "X",
      "upright": { "zh": "轮子转到你这儿了，顺势而为比硬扛省力。", "ja": "輪があなたの番に回ってきた。逆らうより乗るほうが楽だ。" },
      "reversed": { "zh": "轮子往下走，低潮也是周期的一部分。", "ja": "輪は下へ向かう。低潮もまた周期の一部だ。" },
      "questions": {
        "upright": { "zh": "现在的顺风，你打算怎么用？", "ja": "いまの追い風を、どう使うつもりか。" },
        "reversed": { "zh": "这次低谷，轮到你看清什么？", "ja": "この低潮で、何を見る番になったのか。" }
      }
    },
    {
      "id": "tarot22-11",
      "word": { "zh": "正义", "ja": "正義" },
      "symbol": "XI",
      "upright": { "zh": "摆上秤，该算的账要算清，哪怕结果对自己不利。", "ja": "秤にかける。清算すべきものは、自分の不利になるとしても清算する。" },
      "reversed": { "zh": "秤被人为压住，明知不公却选择沉默。", "ja": "秤は人為的に押さえられ、不公正と知りながら沈黙する。" },
      "questions": {
        "upright": { "zh": "这件事里，你欠了谁一个公平？", "ja": "この件で、誰に公正を欠いているか。" },
        "reversed": { "zh": "你在哪件事上，明知不对却装看不见？", "ja": "どこで、正しくないと知りつつ見ないふりをしているか。" }
      }
    },
    {
      "id": "tarot22-12",
      "word": { "zh": "倒吊人", "ja": "吊られた男" },
      "symbol": "XII",
      "upright": { "zh": "主动停住，换个角度倒着看世界，答案常常在这里出现。", "ja": "自ら止まり、逆さまに世界を見る。答えはしばしばそこで現れる。" },
      "reversed": { "zh": "停住变成了拖延，用「等待时机」掩盖不敢动。", "ja": "停止が先延ばしに変わり、「時を待つ」で動けなさを覆う。" },
      "questions": {
        "upright": { "zh": "如果倒过来看这件事，你会看到什么？", "ja": "これを逆さまに見たら、何が見えるか。" },
        "reversed": { "zh": "你等的时机，需要你自己先做什么？", "ja": "待っている好機は、あなたが先に何をする必要があるのか。" }
      }
    },
    {
      "id": "tarot22-13",
      "word": { "zh": "死神", "ja": "死神" },
      "symbol": "XIII",
      "upright": { "zh": "一段关系或一个阶段确实结束了，承认它才能腾出位置。", "ja": "ある関係や段階は確かに終わった。認めてこそ場所が空く。" },
      "reversed": { "zh": "明知道已经结束，还留着不肯收拾的残局。", "ja": "終わったと知りながら、片づけない残りを抱えている。" },
      "questions": {
        "upright": { "zh": "这段已经结束的东西，你要正式送走它吗？", "ja": "すでに終わったこれを、正式に見送るつもりか。" },
        "reversed": { "zh": "你迟迟不肯收拾的，是哪一件遗物？", "ja": "片づけられずにいるのは、どの遺物か。" }
      }
    },
    {
      "id": "tarot22-14",
      "word": { "zh": "节制", "ja": "節制" },
      "symbol": "XIV",
      "upright": { "zh": "把两种极端倒进同一个杯子，慢慢调出能入口的比例。", "ja": "二つの極端を同じ杯に注ぎ、飲める割合へゆっくり調える。" },
      "reversed": { "zh": "调和失败：要么过满，要么见底，节奏全乱。", "ja": "調合に失敗する。溢れるか、底を突くか。拍子が乱れている。" },
      "questions": {
        "upright": { "zh": "你正在调的那两种东西，比例差在哪里？", "ja": "調えている二つのもの、割合のずれはどこか。" },
        "reversed": { "zh": "你最近在哪件事上，忽冷忽热？", "ja": "最近どこで、熱くなったり冷めたりしているか。" }
      }
    },
    {
      "id": "tarot22-15",
      "word": { "zh": "恶魔", "ja": "悪魔" },
      "symbol": "XV",
      "upright": { "zh": "链子其实松着，是被自己允许的执念拴住了。", "ja": "鎖はじつは緩い。自分が許した執念に縛られているだけだ。" },
      "reversed": { "zh": "开始看清枷锁的真面目，松动的第一步已经迈出。", "ja": "枷の正体が見え始め、緩める一歩はすでに踏み出されている。" },
      "questions": {
        "upright": { "zh": "你现在离不开的，具体是哪一样？", "ja": "いま離れられないものは、具体的に何か。" },
        "reversed": { "zh": "看清之后，你打算先松开哪一个扣？", "ja": "見えた後、どの留め具から外すつもりか。" }
      }
    },
    {
      "id": "tarot22-16",
      "word": { "zh": "塔", "ja": "塔" },
      "symbol": "XVI",
      "upright": { "zh": "建在错误地基上的东西被一击劈开，痛，但从此不必再假装牢固。", "ja": "誤った土台の上のものが一撃で裂かれる。痛いが、もう頑丈なふりをせずに済む。" },
      "reversed": { "zh": "裂缝早就在了，只是还没塌，人人绕着走。", "ja": "亀裂はずっと前からある。まだ崩れないだけ。皆が迂回している。" },
      "questions": {
        "upright": { "zh": "被劈开之后，你终于不必再维持的是什么？", "ja": "裂かれた後、もう保たなくてよくなったものは何か。" },
        "reversed": { "zh": "那道裂缝，你打算继续绕着走多久？", "ja": "その亀裂を、あとどれだけ迂回し続けるのか。" }
      }
    },
    {
      "id": "tarot22-17",
      "word": { "zh": "星星", "ja": "星" },
      "symbol": "XVII",
      "upright": { "zh": "灾后第一口水：希望不需要理由，只需要还愿意抬头。", "ja": "惨事のあとの最初の一口。希望に理由はいらない。まだ見上げる気があるだけでいい。" },
      "reversed": { "zh": "想过抬头，却觉得许愿是幼稚，于是继续低头。", "ja": "見上げようとしたが、願うことは幼いと思い、また俯く。" },
      "questions": {
        "upright": { "zh": "如果允许自己许一个愿望，那是什么？", "ja": "願いを一つ許されるなら、それは何か。" },
        "reversed": { "zh": "你从什么时候开始，不敢期待了？", "ja": "いつから、期待することをやめたのか。" }
      }
    },
    {
      "id": "tarot22-18",
      "word": { "zh": "月亮", "ja": "月" },
      "symbol": "XVIII",
      "upright": { "zh": "夜里看见的全是影子，恐惧被放大，路还在。", "ja": "夜に見えるのは影ばかり。恐怖は膨らむが、道はまだある。" },
      "reversed": { "zh": "雾开始散去，之前吓人的轮廓原来只是树枝。", "ja": "霧が晴れはじめ、恐ろしかった輪郭はただの枝だったと分かる。" },
      "questions": {
        "upright": { "zh": "你怕的那个东西，名字叫什么？", "ja": "恐れているものの、名は何か。" },
        "reversed": { "zh": "雾散之后，哪一件事其实没那么可怕？", "ja": "霧が晴れれば、どれほど恐ろしくないか。" }
      }
    },
    {
      "id": "tarot22-19",
      "word": { "zh": "太阳", "ja": "太陽" },
      "symbol": "XIX",
      "upright": { "zh": "事情明明白白地被照亮，允许自己单纯地高兴一次。", "ja": "物事が明々と照らされる。素直に一度くらい喜んでいい。" },
      "reversed": { "zh": "光在，却被自己拉上的帘子挡住了。", "ja": "光はあるのに、自分で引いたカーテンに遮られている。" },
      "questions": {
        "upright": { "zh": "这件值得高兴的事，你打算跟谁分享？", "ja": "喜ぶべきこの件、誰と分かち合うつもりか。" },
        "reversed": { "zh": "你为什么不肯让自己高兴？", "ja": "なぜ、自分が喜ぶことを許さないのか。" }
      }
    },
    {
      "id": "tarot22-20",
      "word": { "zh": "审判", "ja": "審判" },
      "symbol": "XX",